<!ELEMENT servicios (servicio+)>
        <!ELEMENT servicio (nombre,valor,activo)>
        <!ELEMENT nombre (#PCDATA)>
        <!ELEMENT valor (#PCDATA)>
        <!ELEMENT activo (#PCDATA)>
